{
  "tenantAlias": "test_safdsgsfghxbcvxgfsdg",
  "programId": "referral",
  "referralCode": "LORETTABURKE",
  "shareLink": "http://example.com/free?mn",
  "referrer": {
    "id": "5d963756e4b08121fc35b384",
    "accountId": "ICMVMRLASZRULVSB",
    "firstName": "Loretta",
    "lastName": "Burke",
    "imageUrl": ""
  },
  "integrationConfig": {
    "referral": "http://saasquatch.onelink.me/btab/referraltest"
  },
  "downstreamUrl": "http://www.example.com/referrals?utm_source=invite&utm_medium=link&utm_campaign=saasquatch&rsCode=LORETTABURKE&rsShareMedium=UNKNOWN&rsEngagementMedium=UNKNOWN&_saasquatch=eyJzdGFnaW5nLnJlZmVycmFsc2Fhc3F1YXRjaC5jb20iOnsidGVzdF9hY29jYXl0NGFvdjl6X0NPREUiOnsiY29kZXMiOnsiYSI6Ik9ORUxJTksyNzMiLCJiIjoiT05FTElOSzIzNyIsImNsYXNzaWMiOiJPTkVMSU5LIiwicHJvZ3JhbWEiOiIxMUNPREU3NTQ5In0sImNvZGVzRXhwIjp7Ik9ORUxJTksyNzMiOjE2MjgyMDk2MTMsIjExQ09ERTc1NDkiOjE2MjY4MTcxNzIsIk9ORUxJTksyMzciOjE2MjgyODM3OTl9LCJsaW5rcyI6eyJhIjoiaHR0cHM6Ly9kZXJlay10ZXN0LnNzcXQuY28vbXp6eWhxIiwiYiI6Imh0dHBzOi8vZGVyZWstdGVzdC5zc3F0LmNvL216enlociJ9LCJsaW5rc0V4cCI6eyJodHRwczovL2RlcmVrLXRlc3Quc3NxdC5jby9tenp5aHIiOjE2MjgyODM3OTksImh0dHBzOi8vZGVyZWstdGVzdC5zc3F0LmNvL216enlocSI6MTYyODIwOTYxM319fX0",
  "signupUrl": "http://www.example.com/referrals?utm_source=invite&utm_medium=link&utm_campaign=saasquatch&rsCode=LORETTABURKE&rsShareMedium=UNKNOWN&rsEngagementMedium=UNKNOWN&_saasquatch=eyJzdGFnaW5nLnJlZmVycmFsc2Fhc3F1YXRjaC5jb20iOnsidGVzdF9hY29jYXl0NGFvdjl6X0NPREUiOnsiY29kZXMiOnsiYSI6Ik9ORUxJTksyNzMiLCJiIjoiT05FTElOSzIzNyIsImNsYXNzaWMiOiJPTkVMSU5LIiwicHJvZ3JhbWEiOiIxMUNPREU3NTQ5In0sImNvZGVzRXhwIjp7Ik9ORUxJTksyNzMiOjE2MjgyMDk2MTMsIjExQ09ERTc1NDkiOjE2MjY4MTcxNzIsIk9ORUxJTksyMzciOjE2MjgyODM3OTl9LCJsaW5rcyI6eyJhIjoiaHR0cHM6Ly9kZXJlay10ZXN0LnNzcXQuY28vbXp6eWhxIiwiYiI6Imh0dHBzOi8vZGVyZWstdGVzdC5zc3F0LmNvL216enlociJ9LCJsaW5rc0V4cCI6eyJodHRwczovL2RlcmVrLXRlc3Quc3NxdC5jby9tenp5aHIiOjE2MjgyODM3OTksImh0dHBzOi8vZGVyZWstdGVzdC5zc3F0LmNvL216enlocSI6MTYyODIwOTYxM319fX0"
}
